{
  "apiVersion": "devrelay.dev/v1alpha1",
  "kind": "ModuleRouteDecision",
  "module": {
    "id": "architecture-design",
    "version": "0.1.0"
  },
  "state": {
    "artifactId": "project-architecture-state-specialist-assignment-v1",
    "schema": "https://devrelay.dev/artifacts/project-architecture-state/v1",
    "digest": "sha256:aed4d3ad138a2d7e2bb05850cbe52f95a51bff7ace96200135ddf76642ada2d8"
  },
  "discriminator": {
    "path": "/state",
    "value": "baselined"
  },
  "reasonCode": "BASELINE_REQUIRES_CHANGE_DESIGN",
  "selection": {
    "kind": "operation",
    "operation": "design-change"
  }
}
