{
  "apiVersion": "devrelay.dev/v1alpha1",
  "kind": "ModuleRouteDecision",
  "module": {
    "id": "architecture-design",
    "version": "0.1.0"
  },
  "state": {
    "artifactId": "project-architecture-state-v0.11-module-quality-v1",
    "schema": "https://devrelay.dev/artifacts/project-architecture-state/v1",
    "digest": "sha256:e04cf807578db03e4983b074133e00d5f635abd96fc29d77d66acf120e438070"
  },
  "discriminator": {
    "path": "/state",
    "value": "baselined"
  },
  "reasonCode": "BASELINE_REQUIRES_CHANGE_DESIGN",
  "selection": {
    "kind": "operation",
    "operation": "design-change"
  }
}
