{
  "apiVersion": "devrelay.dev/v1alpha1",
  "kind": "ModuleRouteDecision",
  "module": {
    "id": "architecture-design",
    "version": "0.1.0"
  },
  "state": {
    "artifactId": "project-architecture-state-ep-001-environment-preparation-v1",
    "schema": "https://devrelay.dev/artifacts/project-architecture-state/v1",
    "digest": "sha256:8f0a471bb5f2c3b840ca49e8a55e71f63ea9d505444a995359aff10e16857f31"
  },
  "discriminator": {
    "path": "/state",
    "value": "baselined"
  },
  "reasonCode": "BASELINE_REQUIRES_CHANGE_DESIGN",
  "selection": {
    "kind": "operation",
    "operation": "design-change"
  }
}
